{
  "schema": "materials-simulation-skills.index.v1",
  "repository": "HeshamFS/materials-simulation-skills",
  "summary": {
    "skills": 24,
    "scripts": 78,
    "eval_cases": 101,
    "deterministic_checks": 117,
    "eval_coverage": 1.0,
    "categories": [
      "core-numerical",
      "data-management",
      "hpc-deployment",
      "meta",
      "ontology",
      "robustness",
      "simulation-workflow",
      "verification-validation"
    ]
  },
  "skills": [
    {
      "name": "convergence-study",
      "category": "core-numerical",
      "path": "skills/core-numerical/convergence-study",
      "description": "Perform spatial and temporal convergence analysis for solution verification — compute observed convergence orders from grid or timestep refinement studies, apply Richardson extrapolation to estimate discretization error, and calculate the Grid Convergence Index (GCI) per ASME V&V 20 standards. Use when verifying that a numerical solution converges at the expected rate, estimating the error on the finest mesh, checking whether grids are in the asymptotic range, or preparing formal verification reports, even if the user only asks \"is my mesh fine enough\" or \"how accurate is my solution.\"",
      "version": "1.2.1",
      "security_tier": "high",
      "allowed_tools": [],
      "scripts": 4,
      "eval_cases": 4,
      "deterministic_checks": 4,
      "eval_coverage": 1.0,
      "last_evaluated": "2026-06-24"
    },
    {
      "name": "differentiation-schemes",
      "category": "core-numerical",
      "path": "skills/core-numerical/differentiation-schemes",
      "description": "Select and apply numerical differentiation schemes for PDE and ODE discretization — generate finite-difference stencils at arbitrary order and accuracy, choose between central, upwind, compact (Pade), and spectral methods, handle boundary stencils, and estimate truncation error scaling. Use when discretizing spatial derivatives, picking a scheme for advection- or diffusion-dominated problems, building custom stencils for nonstandard operators, or comparing dispersion and dissipation properties of candidate schemes, even if the user just says \"how do I approximate this derivative\" or \"my solution is too diffusive.\"",
      "version": "1.2.1",
      "security_tier": "high",
      "allowed_tools": [
        "Read",
        "Bash",
        "Write",
        "Grep",
        "Glob"
      ],
      "scripts": 3,
      "eval_cases": 4,
      "deterministic_checks": 4,
      "eval_coverage": 1.0,
      "last_evaluated": "2026-06-24"
    },
    {
      "name": "linear-solvers",
      "category": "core-numerical",
      "path": "skills/core-numerical/linear-solvers",
      "description": "Select and configure linear solvers for Ax=b systems arising in numerical simulations — choose between direct (LU, Cholesky) and iterative (CG, GMRES, BiCGSTAB, MINRES) methods, analyze sparsity patterns and matrix conditioning, recommend preconditioners (AMG, ILU, IC), apply row/column scaling, and diagnose convergence stagnation from residual histories. Use when setting up a linear solve for FEM/FVM assembly, debugging slow or stalled Krylov iterations, choosing a preconditioner for SPD or nonsymmetric systems, or investigating ill-conditioning, even if the user only says \"my solver is slow\" or \"GMRES won't converge.\"",
      "version": "1.2.1",
      "security_tier": "medium",
      "allowed_tools": [
        "Read",
        "Write",
        "Grep",
        "Glob"
      ],
      "scripts": 6,
      "eval_cases": 4,
      "deterministic_checks": 7,
      "eval_coverage": 1.0,
      "last_evaluated": "2026-06-24"
    },
    {
      "name": "mesh-generation",
      "category": "core-numerical",
      "path": "skills/core-numerical/mesh-generation",
      "description": "Plan and evaluate mesh generation for numerical simulations — estimate grid resolution from physics scales (interface width, boundary layers, wavelengths), check aspect ratios and skewness against quality thresholds, choose between structured, unstructured, and adaptive mesh refinement strategies, and compute grid sizing for 1D/2D/3D domains. Use when setting up a new mesh, diagnosing poor solver convergence caused by mesh quality, deciding how many points to place across a phase-field interface or boundary layer, or preparing a mesh convergence study, even if the user only asks \"what resolution do I need\" or \"why is my solver failing.\"",
      "version": "1.2.1",
      "security_tier": "medium",
      "allowed_tools": [
        "Read",
        "Write",
        "Grep",
        "Glob"
      ],
      "scripts": 2,
      "eval_cases": 4,
      "deterministic_checks": 5,
      "eval_coverage": 1.0,
      "last_evaluated": "2026-06-24"
    },
    {
      "name": "nonlinear-solvers",
      "category": "core-numerical",
      "path": "skills/core-numerical/nonlinear-solvers",
      "description": "Select and configure nonlinear solvers for root-finding f(x)=0, optimization min F(x), and least-squares problems — choose among Newton, Newton-Krylov, quasi-Newton (BFGS, L-BFGS), Broyden, Anderson acceleration, and Levenberg-Marquardt methods, configure line search or trust-region globalization, diagnose convergence rate (quadratic, linear, stagnated), and assess Jacobian quality and conditioning. Use when a Newton solver converges slowly or diverges, choosing between line search and trust region, debugging nonlinear iteration failures in FEM or phase-field codes, or selecting a solver for large-scale unconstrained optimization, even if the user only says \"my Newton iterations aren't converging.\"",
      "version": "1.2.1",
      "security_tier": "high",
      "allowed_tools": [
        "Read",
        "Bash",
        "Write",
        "Grep",
        "Glob"
      ],
      "scripts": 6,
      "eval_cases": 5,
      "deterministic_checks": 7,
      "eval_coverage": 1.0,
      "last_evaluated": "2026-06-24"
    },
    {
      "name": "numerical-integration",
      "category": "core-numerical",
      "path": "skills/core-numerical/numerical-integration",
      "description": "Select and configure time integration methods for ODE and PDE simulations — choose among explicit Runge-Kutta, BDF, Rosenbrock, and Adams families, set relative and absolute error tolerances, implement adaptive step-size control with P/PI step-size controllers, plan IMEX operator splitting for mixed stiff and non-stiff terms, and estimate splitting errors. Use when picking an integrator for a new simulation, diagnosing step rejections or tolerance failures, setting up operator splitting for phase-field or reaction-diffusion problems, or deciding between explicit and implicit time marching, even if the user only says \"my solver keeps rejecting steps\" or \"which ODE method should I use.\"",
      "version": "1.2.1",
      "security_tier": "medium",
      "allowed_tools": [
        "Read",
        "Write",
        "Grep",
        "Glob"
      ],
      "scripts": 5,
      "eval_cases": 4,
      "deterministic_checks": 5,
      "eval_coverage": 1.0,
      "last_evaluated": "2026-06-24"
    },
    {
      "name": "numerical-stability",
      "category": "core-numerical",
      "path": "skills/core-numerical/numerical-stability",
      "description": "Analyze numerical stability for time-dependent PDE simulations — check CFL and Fourier criteria, perform von Neumann stability analysis, detect stiffness, evaluate matrix conditioning, and recommend explicit vs implicit time-stepping schemes. Use when selecting time steps, diagnosing numerical blow-up or solver divergence, checking convergence criteria, or evaluating scheme stability for advection, diffusion, or reaction problems, even if the user doesn't explicitly mention \"stability\" or \"CFL.\"",
      "version": "1.2.1",
      "security_tier": "high",
      "allowed_tools": [
        "Read",
        "Bash",
        "Write",
        "Grep",
        "Glob"
      ],
      "scripts": 4,
      "eval_cases": 4,
      "deterministic_checks": 4,
      "eval_coverage": 1.0,
      "last_evaluated": "2026-06-24"
    },
    {
      "name": "time-stepping",
      "category": "core-numerical",
      "path": "skills/core-numerical/time-stepping",
      "description": "Plan and control time-step policies for transient simulations — couple CFL and physics-based stability limits with adaptive stepping, ramp initial transients through sharp gradients or phase changes, schedule output intervals and checkpoint cadence, and plan restart strategies for long-running jobs. Use when choosing dt for a new simulation, diagnosing adaptive time-step oscillations, deciding checkpoint frequency to minimize lost work, or setting up output schedules aligned with physical time scales, even if the user only says \"my run is too slow\" or \"how often should I save.\"",
      "version": "1.2.1",
      "security_tier": "high",
      "allowed_tools": [
        "Read",
        "Bash",
        "Write",
        "Grep",
        "Glob"
      ],
      "scripts": 3,
      "eval_cases": 4,
      "deterministic_checks": 4,
      "eval_coverage": 1.0,
      "last_evaluated": "2026-06-24"
    },
    {
      "name": "fair-simulation-packager",
      "category": "data-management",
      "path": "skills/data-management/fair-simulation-packager",
      "description": "Create FAIR-minded reproducibility bundles for materials simulations by collecting input/output file inventories, hashes, units, engine versions, structure identifiers, provenance, and NOMAD/OPTIMADE/Materials Project friendly metadata. Use before publishing, sharing, archiving, or handing simulation results to another agent.",
      "version": "1.2.1",
      "security_tier": "high",
      "allowed_tools": [
        "Read",
        "Bash",
        "Write",
        "Grep",
        "Glob"
      ],
      "scripts": 1,
      "eval_cases": 3,
      "deterministic_checks": 3,
      "eval_coverage": 1.0,
      "last_evaluated": "2026-06-23"
    },